text,category
Bankanızın yurtdışı para transferi hizmeti diğer bankalara göre daha hızlı ve uygun fiyatlı,para transferi
POS cihazınız ödemeleri hızlı ve sorunsuz bir şekilde tamamlamama yardımcı oldu,pos
POS cihazının ekranı net ve anlaşılır işlem sürecini kolayca takip ettim,pos
POS cihazınızın kullanımı oldukça basit herhangi bir sorun yaşamadan ödeme yaptım,pos
POS cihazınızın temaslı ödeme özelliği hızlı ve güvenli bir şekilde işlem yapmamı sağladı,pos
POS cihazınızın kablosuz ödeme seçeneği işlem yaparken esneklik sağladı,pos
POS cihazınızın arızalı olduğunu bildirdim ve hızlıca değiştirilmesi sağlandı,pos
POS cihazınızın bataryası uzun süre dayanıyor işlem esnasında kapanma sorunu yaşamadım,pos
POS cihazınızın işlem hızı oldukça yüksek sıra beklemeden ödeme yapabiliyorum,pos
POS cihazınızın üzerindeki talimatlar ve görseller işlemi adım adım takip etmeme yardımcı oldu,pos
POS cihazınızın temaslı ödeme desteği kart bilgilerimi tekrar tekrar girmeme gerek bırakmıyor,pos
Müşteri hizmetleri ekibiniz sorunumu hızlı bir şekilde çözdü ve çok yardımcı oldu,müşteri hizmetleri
Müşteri hizmetleri temsilciniz profesyonel ve anlayışlı bir şekilde davrandı teşekkür ederim,müşteri hizmetleri
Müşteri hizmetleri ekibiniz beni dinledi ve taleplerime uygun bir çözüm sundu,müşteri hizmetleri
Müşteri hizmetleri temsilciniz karşılaştığım teknik bir sorunu çözmek için uzmanlıkla yardımcı oldu,müşteri hizmetleri
Müşteri hizmetleri ekibiniz oluşan karışıklığı anında düzelten etkili bir çözüm üretti,müşteri hizmetleri
Müşteri hizmetleri temsilciniz güler yüzlü ve sabırlı yaklaşımıyla olumlu bir deneyim yaşattı,müşteri hizmetleri
Müşteri hizmetleri ekibiniz gereken bilgileri hızlıca sağlayarak bekleme süremi minimuma indirdi,müşteri hizmetleri
Müşteri hizmetleri temsilciniz sorularımı sabırla yanıtladı ve endişelerimi giderdi,müşteri hizmetleri
Müşteri hizmetleri ekibiniz yaşadığım sorunu hızlıca çözerek beni memnun etti,müşteri hizmetleri
Müşteri hizmetleri temsilciniz hatalı bir ücreti iade ederek güvenilirliğinizi gösterdi,müşteri hizmetleri
Kredi başvurum olumlu sonuçlandı ve sunduğunuz faiz oranları oldukça avantajlıydı,kredi başvurusu
Kredi başvurum için bankanızın internet bankacılığı arayüzünü kullandım kolay ve hızlıydı,kredi başvurusu
Kredi başvurumda bankanızın mobil uygulamasını kullandım ve başvurum hızlıca onaylandı,kredi başvurusu
Kredi başvurum için bankanızın şubesine gittim ve profesyonel bir hizmet aldım,kredi başvurusu
Kredi başvurumun onay süreci oldukça hızlıydı ve ihtiyacımı karşıladı,kredi başvurusu
Kredi başvurum sırasında ihtiyacım olan belgeleri kolayca sunabildim ve onay aldım,kredi başvurusu
Kredi başvurumun onaylandığına dair SMS almak beni mutlu etti teşekkür ederim,kredi başvurusu
Kredi başvurumun olumsuz sonuçlandığını öğrendim ancak size olan güvenim değişmedi,kredi başvurusu
Kredi başvurum sırasında bankanızın müşteri temsilcisi beni doğru bilgilendirdi,kredi başvurusu
Kredi başvurumda yaşadığım sorun için bankanızın müşteri hizmetlerine teşekkür ederim,kredi başvurusu
Mobil uygulamanızdaki güncellemeler kullanıcı deneyimini sürekli olarak geliştiriyor,mobil uygulama
Mobil uygulamanızın tasarımı kullanıcı dostu ve işlemleri kolayca yapmamı sağlıyor,mobil uygulama
Mobil uygulamanızın hızı işlem yaparken bekleme süresini minimuma indiriyor,mobil uygulama
Mobil uygulamanızdaki hesap bilgileri detaylı ve anlaşılır bir şekilde sunuluyor,mobil uygulama
Mobil uygulamanızın güvenlik önlemleri hesap güvenliğime ekstra bir güven duygusu veriyor,mobil uygulama
Mobil uygulamanızdaki para transferi seçeneği hızlı ve sorunsuz bir şekilde çalışıyor,mobil uygulama
Mobil uygulamanızın döviz kuru bilgileri güncel ve doğru veriler sunuyor,mobil uygulama
Mobil uygulamanızdaki bildirimler hesap hareketlerimi anında takip etmemi sağlıyor,mobil uygulama
Mobil uygulamanızın işlem geçmişi geçmiş işlemlerimi detaylı bir şekilde görmeme olanak tanıyor,mobil uygulama
Mobil uygulamanızdaki kredi kartı işlemleri harcamalarımı kontrol altında tutmama yardımcı oluyor,mobil uygulama
Bankanızın ücretlendirme politikası şeffaf ve anlaşılır bir şekilde açıklanmış,ücretlendirme
Ücretlendirme konusunda bankanızın sunduğu avantajlar müşteri olarak memnun ediyor,ücretlendirme
Bankanızın hesap işletim ücreti diğer bankalara göre oldukça düşük ve kabul edilebilir,ücretlendirme
Ücretlendirme konusundaki detaylı bilgileri bankanızın internet sitesinde rahatlıkla buldum,ücretlendirme
Bankanızın yıllık kart ücreti sunduğu ekstra hizmetlerle orantılı ve adil bir tutarda,ücretlendirme
Ücretlendirme politikanızı gözden geçirerek müşteri geri bildirimlerine önem verdiğiniz belli oluyor,ücretlendirme
Bankanızın para transferi ücretleri diğer bankalara göre daha uygun fiyatlı,ücretlendirme
Ücretlendirme politikanızda açıklanan ekstra ücretler beklenmedik sürprizler yaşamamı engelliyor,ücretlendirme
Bankanızın kredi başvuru ücreti başvuruyu gerçekleştirmeden önce net bir şekilde belirtilmiş,ücretlendirme
Ücretlendirme politikanızdaki promosyonlar müşterilere sağladığınız ayrıcalıklardan biri,ücretlendirme
Bankanızın ATM'leri geniş dağılımı sayesinde her zaman ulaşılabilir ve kullanışlı,atm
ATM'lerinizdeki işlem menüleri basit ve anlaşılır işlem yapmak kolay,atm
ATM'lerinizin güvenlik önlemleri işlem yaparken kendimi güvende hissetmeme yardımcı oluyor,atm
ATM'lerinizdeki para çekme limitleri günlük ihtiyaçlarımı karşılamaya uygun ve yeterli,atm
Bankanızın ATM'lerindeki para yatırma işlemleri hızlı ve kesintisiz bir şekilde gerçekleşiyor,atm
ATM'lerinizin temiz ve bakımlı olması müşteri deneyimini olumlu yönde etkiliyor,atm
ATM'lerinizin yerleşim planı şehirdeki yoğun kullanım alanlarına uygun olarak düzenlenmiş,atm
ATM'lerinizdeki işlem hızı sıra beklemeden hızlıca işlem yapma imkanı sağlıyor,atm
ATM'lerinizdeki para çekme adımları diğer bankalardan daha az zaman alıyor,atm
ATM'lerinizdeki ekranlar ve tuşlar kullanımı kolay ve anlaşılır bir yapıya sahip,atm
Kredi kartımın ekstresi harcamalarımı detaylı bir şekilde görmeme olanak tanıyor,kredi kartı
Kredi kartımın limit artırım talebim hızlı bir şekilde onaylandı ve memnun kaldım,kredi kartı
Kredi kartımı yurt dışında kullanmak için önceden bilgilendirmiştim ve sorunsuzca kullanabildim,kredi kartı
Kredi kartımın mobil uygulaması harcamalarımı anlık olarak takip etmeyi kolaylaştırıyor,kredi kartı
Kredi kartımın ekstresindeki kampanyalar harcamalarımı avantajlı hale getiriyor,kredi kartı
Kredi kartımın güvenlik önlemleri çalıntı veya kaybolma durumunda hızlıca harekete geçiyor,kredi kartı
Kredi kartımın internet alışverişlerinde kullanılan güvenlik doğrulaması ekstra bir güvence sağlıyor,kredi kartı
Kredi kartımın yıllık aidat ücreti sunduğu avantajlarla orantılı ve kabul edilebilir,kredi kartı
Kredi kartımın ekstresinde yer alan taksitlendirme seçenekleri ödemelerimi planlamayı kolaylaştırıyor,kredi kartı
Kredi kartımın vadesinde ödeme yapmak için hatırlatıcı SMS alıyorum bu özellikten memnunum,kredi kartı
Internet bankacılığı üzerinden kredi başvurusu yapmak oldukça basit ve zaman tasarrufu sağlıyor,internet bankacılığı
Internet bankacılığı arayüzü kullanıcı dostu ve işlemleri hızlıca gerçekleştirmeme yardımcı oluyor,internet bankacılığı
Internet bankacılığından fatura ödeme ve para transferi yapmak güvenli ve kolay,internet bankacılığı
Internet bankacılığı hesap geçmişim ve harcamalarımı detaylı olarak görüntüleme olanağı sunuyor,internet bankacılığı
Internet bankacılığındaki anlık bildirimler hesap hareketlerimi anında takip etmeme yardımcı oluyor,internet bankacılığı
Internet bankacılığındaki döviz işlemleri hızlı ve güvenli bir şekilde gerçekleşiyor,internet bankacılığı
Internet bankacılığındaki hesap analizleri harcamalarımı daha iyi yönetmemi sağlıyor,internet bankacılığı
Internet bankacılığındaki kredi kartı işlemleri harcamalarımı anlık olarak takip etmeyi kolaylaştırıyor,internet bankacılığı
Internet bankacılığındaki hesap geçmişi geçmiş işlemlerimi detaylı bir şekilde görüntüleme imkanı sağlıyor,internet bankacılığı
Internet bankacılığındaki döviz kuru bilgileri güncel ve doğru veriler sunuyor,internet bankacılığı
Faiz işlemi sırasında hesabımdan yanlışlıkla fazla faiz kesildi düzeltilmesini talep ediyorum,faiz işlem
Faiz işlemi sırasında hesabımdan beklenmedik bir şekilde daha az faiz kesildi açıklama istiyorum,faiz işlem
Faiz işlemi sırasında sistemsel bir hata nedeniyle işlem başarısız oldu tekrar denemem gerekti,faiz işlem
Faiz işlemi sırasında yapılan hesaplamada hata olduğunu düşünüyorum kontrol edilmesini istiyorum,faiz işlem
Faiz işlemi sırasında hesabımdan yanlış faiz oranı uygulandı düzeltilmesini talep ediyorum,faiz işlem
Faiz işlemi için bankanızın müşteri temsilcisini aradım sorunum hızlıca çözüldü,faiz işlem
Faiz işlemi sırasında hesabımdan fazla faiz kesildi iade talep ediyorum,faiz işlem
Faiz işlemi sırasında uygulanan faiz oranı hakkında daha detaylı bilgi almak istiyorum,faiz işlem
Faiz işlemi için kullandığım ATM'nin ekranı sorunlu işlem sırasında güçlük çektim,faiz işlem
Faiz işlemi sırasında bankanızın internet sitesini kullandım işlem başarılı ve hızlıydı,faiz işlem
Bankanızın şubesine giderek güler yüzlü bir şekilde karşılandım ve işlemimi hızlıca tamamladım,şube hizmeti
Şubenizdeki temsilci ihtiyacım olan belgeleri detaylı bir şekilde açıkladı ve yardımcı oldu,şube hizmeti
Şubenizdeki müşteri temsilcisi işlem sürecini anlatarak beni aydınlattı ve memnun etti,şube hizmeti
Şubenizdeki hizmet kalitesi yüksek müşteri memnuniyetine önem verildiğini gözlemledim,şube hizmeti
Şubenizdeki temsilci profesyonel bir şekilde yardım sağlayarak endişelerimi giderdi,şube hizmeti
Şubenizdeki hizmet süreci hızlı ve etkili bekleme süresi minimum düzeydeydi,şube hizmeti
Şubenizdeki temsilci karmaşık bir işlemi basit bir şekilde halletmeme yardımcı oldu,şube hizmeti
Şubenizdeki müşteri temsilcisi ihtiyacım olan bilgileri detaylı bir şekilde anlattı ve yönlendirdi,şube hizmeti
Şubenizdeki hizmet kalitesi memnuniyetimi sağlayacak düzeyde ve başarılıydı,şube hizmeti
Şubenizdeki temsilci sorunumu anlamak için zaman ayırarak güven verdi ve çözüm sağladı,şube hizmeti
Çağrı merkezinizdeki müşteri temsilcisi sorunumu hızlı bir şekilde çözdü ve çok yardımcı oldu,çağrı merkezi
Çağrı merkezinizdeki temsilci işlem sürecini basit ve anlaşılır bir şekilde anlattı,çağrı merkezi
Çağrı merkezinizdeki müşteri temsilcisi konuşma sırasında sabırlı ve anlayışlıydı,çağrı merkezi
Çağrı merkezinize ulaşmak kolaydı ve bekletme süresi minimum düzeydeydi,çağrı merkezi
Çağrı merkezinizdeki temsilci sorularıma tatmin edici şekilde yanıtlar vererek güven sağladı,çağrı merkezi
Çağrı merkezinizdeki müşteri temsilcisi konuşma sırasında kibar ve nezaketli davrandı,çağrı merkezi
Çağrı merkezinizdeki temsilci hatalı işlemimi hızlıca düzelterek memnuniyetimi sağladı,çağrı merkezi
Çağrı merkezinizdeki müşteri temsilcisi gereken bilgileri hızlıca sağlayarak bekleme süremi minimuma indirdi,çağrı merkezi
Çağrı merkezinizdeki temsilci uzun süren bir çözümsüzlükten sonra problemlerimi çözdü,çağrı merkezi
Çağrı merkezinizdeki müşteri temsilcisi işlem sürecimi adım adım takip ederek destek sağladı,çağrı merkezi
Para transferi işlemim sırasında bankanızın güvenlik doğrulaması ekstra bir güven duygusu verdi,para transferi
Para transferi işlemim bankanızın mobil uygulamasını kullanarak hızlıca tamamlandı,para transferi
Para transferi işlemim sırasında gerekli bilgileri dikkatlice girdim ve işlem başarılı oldu,para transferi
Para transferi işlemim sırasında yaşadığım teknik bir sorunu bankanızın müşteri hizmetlerine bildirdim ve hızlıca çözüldü,para transferi
Para transferi işlemim bankanızın internet bankacılığı arayüzünü kullanarak kolayca gerçekleşti,para transferi
Para transferi işlemim sırasında gönderici ve alıcı bilgilerini doğru girdiğime dair bildirim aldım,para transferi
Para transferi işlemim sırasında uygulanan ücret makul ve kabul edilebilir bir düzeydeydi,para transferi
Para transferi işlemim sırasında güncel döviz kuru bilgilerine erişmek kolay oldu,para transferi
Para transferi işlemim sırasında bankanızın mobil uygulamasındaki onay ekranı işlemi güvenli hale getirdi,para transferi
Para transferi işlemim sırasında gönderdiğim hesaba hızlıca ulaştı ve bu beni memnun etti,para transferi
POS cihazınızı kullanarak ödememi hızlı ve sorunsuz bir şekilde tamamladım,pos
POS cihazınızın temaslı ödeme özelliği işlem yapmamı kolaylaştırdı,pos
POS cihazınızın kablosuz ödeme seçeneği işlem sırasında esneklik sağladı,pos
POS cihazınızın ekranı net ve anlaşılır işlem sürecini kolayca takip ettim,pos
POS cihazınızın temaslı ödeme desteği kart bilgilerimi tekrar tekrar girmeme gerek bırakmadı,pos
POS cihazınızın hızı sıra beklemeden hızlıca ödeme yapmamı sağladı,pos
POS cihazınızın temaslı ödeme işlemlerinde güvenlik doğrulaması ekstra bir güvence sağladı,pos
POS cihazınızın sesli rehberi işlem adımlarını anlamamı kolaylaştırdı,pos
POS cihazınızın bataryası uzun süre dayanarak işlemi güvenli bir şekilde tamamlamama yardımcı oldu,pos
POS cihazınızın kablosuz ödeme işlemi hızlı ve güvenli bir şekilde gerçekleşti,pos
Müşteri hizmetleri ekibiniz yaşadığım kart kaybı durumunda hızlıca işlem başlattı ve kartımın bloke edilmesini sağladı,müşteri hizmetleri
Müşteri hizmetleri temsilciniz hesap işlemlerimle ilgili sorularıma açıklayıcı ve anlaşılır yanıtlar verdi,müşteri hizmetleri
Müşteri hizmetleri ekibiniz şubeye gitmeden internet bankacılığı üzerinden taleplerimi hızlıca yerine getirdi,müşteri hizmetleri
Müşteri hizmetleri temsilciniz hesap kesim tarihlerini değiştirmem konusunda yardımcı oldu,müşteri hizmetleri
Müşteri hizmetleri ekibiniz yurt dışında kartımın kullanılmadığından emin olmak için benimle güvenlik kontrolleri yaptı,müşteri hizmetleri
Müşteri hizmetleri temsilciniz bankanızın sağladığı promosyonlardan nasıl yararlanabileceğimi anlattı,müşteri hizmetleri
Müşteri hizmetleri ekibiniz kartımdan yapılan hatalı işlemi hızlıca inceleyerek iade işlemini gerçekleştirdi,müşteri hizmetleri
Müşteri hizmetleri temsilciniz kredi başvurusu için gerekli belgeleri e-posta ile göndermemi sağladı,müşteri hizmetleri
Müşteri hizmetleri ekibiniz hesap işlemlerimdeki hatalı ücretleri düzelterek güvenimi yeniden kazandırdı,müşteri hizmetleri
Müşteri hizmetleri temsilciniz bankanızın sağladığı yatırım ürünleri hakkında detaylı bilgiler verdi,müşteri hizmetleri
Kredi başvurum sırasında bankanızın internet sitesindeki hesaplayıcıyı kullanarak aylık ödemelerimi kolayca hesapladım,kredi başvurusu
Kredi başvurumun onaylanmasından sonra bankanızın müşteri temsilcisi kredi kullanımı hakkında detaylı bilgi verdi,kredi başvurusu
Kredi başvurumun onay süreci oldukça hızlıydı ve kredi tutarımı istediğim gibi belirleyebildim,kredi başvurusu
Kredi başvurum için bankanızın mobil uygulamasını kullandım ve başvurum anında onaylandı,kredi başvurusu
Kredi başvurumun olumsuz sonuçlandığını öğrendim ancak bankanızın düşük faizli alternatiflerini değerlendirmeye karar verdim,kredi başvurusu
Kredi başvurumun onaylandığına dair SMS almak beni memnun etti teşekkür ederim,kredi başvurusu
Kredi başvurumun onaylanması sonucunda bankanızın sunduğu ekstra avantajlardan yararlandım,kredi başvurusu
Kredi başvurum sırasında ihtiyacım olan belgeleri bankanızın internet sitesinden kolayca indirdim,kredi başvurusu
Kredi başvurum için bankanızın şubesine gittim ve profesyonel bir hizmet aldım,kredi başvurusu
Kredi başvurumun onay sürecinde bankanızın müşteri temsilcisi sorularımı sabırla yanıtladı ve endişelerimi giderdi,kredi başvurusu
Mobil uygulamanızın yeni güncellemesi işlem süreçlerini daha kullanıcı dostu hale getirdi,mobil uygulama
Mobil uygulamanızdaki hesap geçmişi harcamalarımı anlık olarak takip etmeme olanak sağlıyor,mobil uygulama
Mobil uygulamanızın ekran düzeni işlem adımlarını basit ve anlaşılır bir şekilde sunuyor,mobil uygulama
Mobil uygulamanızdaki döviz kuru bilgileri güncel ve doğru veriler içeriyor,mobil uygulama
Mobil uygulamanızdaki güvenlik önlemleri hesap güvenliğime ekstra bir güven duygusu veriyor,mobil uygulama
Mobil uygulamanızdaki para transferi seçeneği hızlı ve sorunsuz bir şekilde çalışıyor,mobil uygulama
Mobil uygulamanızdaki kredi kartı işlemleri harcamalarımı kontrol altında tutmama yardımcı oluyor,mobil uygulama
Mobil uygulamanızın döviz işlemleri hızlı ve güvenli bir şekilde gerçekleşiyor,mobil uygulama
Mobil uygulamanızdaki hesap analizleri harcamalarımı daha iyi yönetmemi sağlıyor,mobil uygulama
Mobil uygulamanızın işlem geçmişi geçmiş işlemlerimi detaylı bir şekilde görmeme olanak tanıyor,mobil uygulama
Bankanızın ücretlendirme politikası şeffaf ve anlaşılır bir şekilde açıklanmış,ücretlendirme
Ücretlendirme konusunda bankanızın sunduğu avantajlar müşteri olarak memnun ediyor,ücretlendirme
Bankanızın hesap işletim ücreti diğer bankalara göre oldukça düşük ve kabul edilebilir,ücretlendirme
Ücretlendirme konusundaki detaylı bilgileri bankanızın internet sitesinde rahatlıkla buldum,ücretlendirme
Bankanızın yıllık kart ücreti sunduğu ekstra hizmetlerle orantılı ve adil bir tutarda,ücretlendirme
Ücretlendirme politikanızı gözden geçirerek müşteri geri bildirimlerine önem verdiğiniz belli oluyor,ücretlendirme
Bankanızın para transferi ücretleri diğer bankalara göre daha uygun fiyatlı,ücretlendirme
Ücretlendirme politikanızda açıklanan ekstra ücretler beklenmedik sürprizler yaşamamı engelliyor,ücretlendirme
Bankanızın kredi başvuru ücreti başvuruyu gerçekleştirmeden önce net bir şekilde belirtilmiş,ücretlendirme
Ücretlendirme politikanızdaki promosyonlar müşterilere sağladığınız ayrıcalıklardan biri,ücretlendirme
Bankanızın ATM'leri geniş dağılımı sayesinde her zaman ulaşılabilir ve kullanışlı,atm
ATM'lerinizdeki işlem menüleri basit ve anlaşılır işlem yapmak kolay,atm
ATM'lerinizin güvenlik önlemleri işlem yaparken kendimi güvende hissetmeme yardımcı oluyor,atm
ATM'lerinizdeki para çekme limitleri günlük ihtiyaçlarımı karşılamaya uygun ve yeterli,atm
Bankanızın ATM'lerindeki para yatırma işlemleri hızlı ve kesintisiz bir şekilde gerçekleşiyor,atm
ATM'lerinizin temiz ve bakımlı olması müşteri deneyimini olumlu yönde etkiliyor,atm
ATM'lerinizin yerleşim planı şehirdeki yoğun kullanım alanlarına uygun olarak düzenlenmiş,atm
ATM'lerinizdeki işlem hızı sıra beklemeden hızlıca işlem yapma imkanı sağlıyor,atm
ATM'lerinizdeki para çekme adımları diğer bankalardan daha az zaman alıyor,atm
ATM'lerinizdeki ekranlar ve tuşlar kullanımı kolay ve anlaşılır bir yapıya sahip,atm
Kredi kartımın ekstresi harcamalarımı detaylı bir şekilde görmeme olanak tanıyor,kredi kartı
Kredi kartımın limit artırım talebim hızlı bir şekilde onaylandı ve memnun kaldım,kredi kartı
Kredi kartımı yurt dışında kullanmak için önceden bilgilendirmiştim ve sorunsuzca kullanabildim,kredi kartı
Kredi kartımın mobil uygulaması harcamalarımı anlık olarak takip etmeyi kolaylaştırıyor,kredi kartı
Kredi kartımın ekstresindeki kampanyalar harcamalarımı avantajlı hale getiriyor,kredi kartı
Kredi kartımın güvenlik önlemleri çalıntı veya kaybolma durumunda hızlıca harekete geçiyor,kredi kartı
Kredi kartımın internet alışverişlerinde kullanılan güvenlik doğrulaması ekstra bir güvence sağlıyor,kredi kartı
Kredi kartımın yıllık aidat ücreti sunduğu avantajlarla orantılı ve kabul edilebilir,kredi kartı
Kredi kartımın ekstresinde yer alan taksitlendirme seçenekleri ödemelerimi planlamayı kolaylaştırıyor,kredi kartı
Kredi kartımın vadesinde ödeme yapmak için hatırlatıcı SMS alıyorum bu özellikten memnunum,kredi kartı
Internet bankacılığı üzerinden kredi başvurusu yapmak oldukça basit ve zaman tasarrufu sağlıyor,internet bankacılığı
Internet bankacılığı arayüzü kullanıcı dostu ve işlemleri hızlıca gerçekleştirmeme yardımcı oluyor,internet bankacılığı
Internet bankacılığından fatura ödeme ve para transferi yapmak güvenli ve kolay,internet bankacılığı
Internet bankacılığı hesap geçmişim ve harcamalarımı detaylı olarak görüntüleme olanağı sunuyor,internet bankacılığı
Internet bankacılığındaki anlık bildirimler hesap hareketlerimi anında takip etmeme yardımcı oluyor,internet bankacılığı
Internet bankacılığındaki döviz işlemleri hızlı ve güvenli bir şekilde gerçekleşiyor,internet bankacılığı
Internet bankacılığındaki hesap analizleri harcamalarımı daha iyi yönetmemi sağlıyor,internet bankacılığı
Internet bankacılığındaki kredi kartı işlemleri harcamalarımı anlık olarak takip etmeyi kolaylaştırıyor,internet bankacılığı
Internet bankacılığındaki hesap geçmişi geçmiş işlemlerimi detaylı bir şekilde görmeme olanak tanıyor,internet bankacılığı
Internet bankacılığındaki döviz kuru bilgileri güncel ve doğru veriler sunuyor,internet bankacılığı
Faiz işlemi sırasında hesabımdan yanlışlıkla fazla faiz kesildi düzeltilmesini talep ediyorum,faiz işlem
Faiz işlemi sırasında hesabımdan beklenmedik bir şekilde daha az faiz kesildi açıklama istiyorum,faiz işlem
Faiz işlemi sırasında sistemsel bir hata nedeniyle işlem başarısız oldu tekrar denemem gerekti,faiz işlem
Faiz işlemi sırasında yapılan hesaplamada hata olduğunu düşünüyorum kontrol edilmesini istiyorum,faiz işlem
Faiz işlemi sırasında hesabımdan yanlış faiz oranı uygulandı düzeltilmesini talep ediyorum,faiz işlem
Faiz işlemi için bankanızın müşteri temsilcisini aradım sorunum hızlıca çözüldü,faiz işlem
Faiz işlemi sırasında hesabımdan fazla faiz kesildi iade talep ediyorum,faiz işlem
Faiz işlemi sırasında uygulanan faiz oranı hakkında daha detaylı bilgi almak istiyorum,faiz işlem
Faiz işlemi için kullandığım ATM'nin ekranı sorunlu işlem sırasında güçlük çektim,faiz işlem
Faiz işlemi sırasında bankanızın internet sitesini kullandım işlem başarılı ve hızlıydı,faiz işlem
Bankanızın şubesine giderek güler yüzlü bir şekilde karşılandım ve işlemimi hızlıca tamamladım,şube hizmeti
Şubenizdeki temsilci ihtiyacım olan belgeleri detaylı bir şekilde açıkladı ve yardımcı oldu,şube hizmeti
Şubenizdeki müşteri temsilcisi işlem sürecini anlatarak beni aydınlattı ve memnun etti,şube hizmeti
Şubenizdeki hizmet kalitesi yüksek müşteri memnuniyetine önem verildiğini gözlemledim,şube hizmeti
Şubenizdeki temsilci profesyonel bir şekilde yardım sağlayarak endişelerimi giderdi,şube hizmeti
Şubenizdeki hizmet süreci hızlı ve etkili bekleme süresi minimum düzeydeydi,şube hizmeti
Şubenizdeki temsilci karmaşık bir işlemi basit bir şekilde halletmeme yardımcı oldu,şube hizmeti
Şubenizdeki müşteri temsilcisi ihtiyacım olan bilgileri detaylı bir şekilde anlattı ve yönlendirdi,şube hizmeti
Şubenizdeki hizmet kalitesi memnuniyetimi sağlayacak düzeyde ve başarılıydı,şube hizmeti
Şubenizdeki temsilci sorunumu anlamak için zaman ayırarak güven verdi ve çözüm sağladı,şube hizmeti
Çağrı merkezinizdeki müşteri temsilcisi sorunumu hızlı bir şekilde çözdü ve çok yardımcı oldu,çağrı merkezi
Çağrı merkezinizdeki temsilci işlem sürecini basit ve anlaşılır bir şekilde anlattı,çağrı merkezi
Çağrı merkezinizdeki müşteri temsilcisi konuşma sırasında sabırlı ve anlayışlıydı,çağrı merkezi
Çağrı merkezinize ulaşmak kolaydı ve bekletme süresi minimum düzeydeydi,çağrı merkezi
Çağrı merkezinizdeki temsilci sorularıma tatmin edici şekilde yanıtlar vererek güven sağladı,çağrı merkezi
Çağrı merkezinizdeki müşteri temsilcisi konuşma sırasında kibar ve nezaketli davrandı,çağrı merkezi
Çağrı merkezinizdeki müşteri temsilcisi sorunlarımı hızlıca çözerek memnun bıraktı,çağrı merkezi
Çağrı merkezinizdeki temsilci uzun süren bir çözümsüzlükten sonra problemlerimi çözdü,çağrı merkezi
Çağrı merkezinizdeki müşteri temsilcisi işlem sürecimi adım adım takip ederek destek sağladı,çağrı merkezi
Çağrı merkezinizdeki temsilci gereken bilgileri hızlıca sağlayarak bekleme süremi minimuma indirdi,çağrı merkezi
