text,category
Bankanızın çağrı merkezi herhangi bir sorun yaşadığımda hızlıca destek sağlıyor,çağrı merkezi
Çağrı merkezi temsilcileri sorularıma sabırla ve anlayışla yanıt veriyor ve beni memnun ediyor,çağrı merkezi
Çağrı merkezinizi aradığımda kısa sürede bir müşteri temsilcisi ile görüşebiliyorum,çağrı merkezi
Bankanızın çağrı merkezine ulaşım oldukça kolay ve erişilebilir durumda,çağrı merkezi
Çağrı merkezinizdeki işlem süreçleri oldukça hızlı ve pratik bir şekilde tamamlanıyor,çağrı merkezi
Çağrı merkezi temsilcileriniz kredi başvurusu konusunda gereken belgeleri detaylıca anlatıyor,çağrı merkezi
Çağrı merkeziniz hesap işlemleri ve banka ürünleri hakkında detaylı bilgi sağlıyor,çağrı merkezi
Çağrı merkezinizdeki müşteri temsilcileri tatil günleri dahil sürekli erişilebilir durumda,çağrı merkezi
Çağrı merkeziniz işlem süreçlerini takip etmek ve geri bildirimde bulunmak için oldukça kullanışlı,çağrı merkezi
Çağrı merkezinizdeki müşteri temsilcileri güler yüzlü ve işini severek yapıyor,çağrı merkezi
Bankanızın para transferi hizmeti diğer bankalara göre oldukça hızlı ve güvenli,para transferi
Para transferi işlemi için bankanızın mobil uygulamasını tercih ettim ve işlemim sorunsuzca tamamlandı,para transferi
Bankanızın internet bankacılığı üzerinden yaptığım para transferi anında hesaba geçti ve memnun kaldım,para transferi
Para transferi sırasında bankanızın sunduğu ek güvenlik adımları hesabımın korunmasına yardımcı oldu,para transferi
Bankanızın para transferi hizmeti yurt içi ve yurt dışı işlemlerde oldukça kullanışlı,para transferi
Para transferi işlemi sırasında bankanızın mobil uygulamasındaki onay süreci oldukça hızlıydı,para transferi
Bankanızın para transferi ücretleri diğer bankalara göre oldukça avantajlı,para transferi
Para transferi sırasında bankanızın müşteri temsilcileri herhangi bir gecikme yaşamadan işlemimi tamamladı,para transferi
Para transferi işlemi için bankanızın internet sitesindeki menü seçenekleri oldukça anlaşılır,para transferi
Bankanızın para transferi hizmeti anlık olarak yapılan işlemlerde güven veriyor,para transferi
Bankanızın pos cihazları iş yerimde kullanımı kolay ve hızlı bir şekilde işlem yapmama olanak sağlıyor,pos
POS cihazınızın kullanım kılavuzu oldukça açıklayıcı ve işlem süreçlerini kolaylaştırıyor,pos
POS cihazlarınızın şarj süresi oldukça uzun bu da işlem yaparken kesinti yaşamamı engelliyor,pos
POS cihazınızın işlem süreci oldukça hızlı ve müşterilerim memnun kalıyor,pos
Bankanızın POS cihazları ödeme onay sürecini hızlandırıyor ve sıra bekleme süresini azaltıyor,pos
POS cihazınızın dokunmatik ekranı işlem yapmayı kolay ve kullanıcı dostu hale getiriyor,pos
Bankanızın POS cihazları çevrimdışı işlemlerde de oldukça güvenli ve sorunsuz çalışıyor,pos
POS cihazlarınızın tasarımı masamda az yer kaplaması açısından oldukça pratik,pos
POS cihazlarınızın kablosuz bağlantısı hareket özgürlüğümü artırıyor ve işlem yapmamı kolaylaştırıyor,pos
POS cihazınızın ödeme onay süreci oldukça hızlı bu da müşteri memnuniyetini artırıyor,pos
Müşteri hizmetleri ekibi hesabımdaki yanlış ücretleri düzeltmek için hemen işlem başlattı,müşteri hizmetleri
Müşteri hizmetleri temsilciniz kayıp kredi kartımı hızlıca bloke etti ve yeni kart talebimi aldı,müşteri hizmetleri
Müşteri hizmetleri ekibiniz şubeye gitmeden internet bankacılığı üzerinden kredi başvurumu kolayca tamamlamama yardımcı oldu,müşteri hizmetleri
Müşteri hizmetleri temsilciniz hesap kesim tarihimi değiştirmem konusunda yardımcı ve anlayışlıydı,müşteri hizmetleri
Müşteri hizmetleri ekibiniz kartımdan yapılan şüpheli işlemi hızlıca inceleyerek geri ödememi sağladı,müşteri hizmetleri
Müşteri hizmetleri temsilciniz bankanızın sunduğu yatırım ürünleri hakkında bana detaylı bilgi verdi,müşteri hizmetleri
Müşteri hizmetleri ekibiniz hesabımdaki eksik para transferini hızlıca tamamladı,müşteri hizmetleri
Müşteri hizmetleri temsilciniz bankanızın ücretlendirme politikası hakkında şeffaf bir şekilde bilgi verdi,müşteri hizmetleri
Müşteri hizmetleri ekibiniz hesabıma eklediğim ikinci hesabın onay sürecini hızlandırdı,müşteri hizmetleri
Müşteri hizmetleri temsilciniz kredi başvurusu için gereken belgeleri e-posta ile göndermemi sağladı,müşteri hizmetleri
Kredi başvurum hızlıca onaylandı ve acil durumumu çözmeme yardımcı oldu,kredi başvurusu
Kredi başvurum sırasında talep ettiğim limit ihtiyacım olan miktarı karşılayacak düzeydeydi,kredi başvurusu
Kredi başvurumun onaylanması için gerekli belgeleri kolayca ve hızlıca tamamladım,kredi başvurusu
Kredi başvurusu işlem sürecinde bankanızın müşteri temsilcisi sorularıma hızlıca yanıt verdi,kredi başvurusu
Kredi başvurumu online olarak yaptım ve işlem sırasında herhangi bir aksaklık yaşamadım,kredi başvurusu
Kredi başvurumun sonucunda aldığım geri dönüş oldukça hızlıydı ve memnuniyetim sağlandı,kredi başvurusu
Kredi başvurumu kolayca gerçekleştirebilmek için bankanızın mobil uygulamasını tercih ettim,kredi başvurusu
Kredi başvurumun onay sürecinde bankanızın sistemsel olarak güncel bilgileri alması işlemi hızlandırdı,kredi başvurusu
Kredi başvurumda talep ettiğim vade süresi geri ödeme planıma uygun olarak düzenlendi,kredi başvurusu
Kredi başvurumun onay sürecinde bankanızın internet bankacılığını kullanarak belge gönderdim,kredi başvurusu
Mobil uygulamanızı kullanarak kredi başvurusu yapmak oldukça basit ve zamanımı kurtardı,mobil uygulama
Mobil uygulamanızın arayüzü kullanıcı dostu ve işlemleri hızlıca gerçekleştirmeme yardımcı oluyor,mobil uygulama
Mobil uygulamanızdan fatura ödeme ve para transferi yapmak güvenli ve kolay,mobil uygulama
Mobil uygulamanızın güvenlik önlemleri hesabımın güvende olduğunu hissetmeme yardımcı oluyor,mobil uygulama
Mobil uygulamanızı kullanarak hesap hareketlerimi anında takip edebiliyor ve bütçemi yönetebiliyorum,mobil uygulama
Mobil uygulamanızın kullanıcı deneyimi diğer bankalara göre oldukça başarılı ve tatmin edici,mobil uygulama
Mobil uygulamanızdaki otomatik ödeme talimatı ayarlayarak faturalarımı düzenli olarak ödeyebiliyorum,mobil uygulama
Mobil uygulamanızın sunduğu kredi başvurusu imkanı ihtiyacım olan paraya hızlıca ulaşmamı sağladı,mobil uygulama
Mobil uygulamanız hesap işlemlerini hızlıca gerçekleştirme kolaylığı sağlıyor,mobil uygulama
Mobil uygulamanızın şifre değiştirme işlemi hesap güvenliğimi sağlamak için etkili ve pratik,mobil uygulama
Bankanızın ücretlendirme politikası şeffaf ve açık bir şekilde sunuluyor,ücretlendirme
Ücretlendirme konusundaki bilgilere bankanızın internet sitesinden kolayca ulaşabiliyorum,ücretlendirme
Hesap işletim ücreti konusunda bankanızın sunduğu seçenekler ihtiyacıma uygun ve mantıklı,ücretlendirme
Bankanızın kredi kartı ücretleri diğer bankalara göre oldukça uygun ve avantajlı,ücretlendirme
Ücretlendirme politikasındaki değişiklikler önceden bildirilerek müşteri memnuniyeti sağlanıyor,ücretlendirme
Ücretlendirme konusundaki bilgiler müşteri temsilcileri tarafından anlaşılır bir şekilde aktarılıyor,ücretlendirme
Bankanızın atm kullanım ücretleri geniş atm ağı ile müşteriye kolaylık sağlıyor,ücretlendirme
Ücretlendirme politikasındaki hesap kesim tarihi ve detayları düzenli olarak ekstrede yer alıyor,ücretlendirme
Mobil uygulama ve internet bankacılığındaki işlemler için alınan ücretler makul ve adil,ücretlendirme
Ücretlendirme konusundaki bilgiler bankanızın müşteri hizmetleri tarafından anında sağlanıyor,ücretlendirme
Bankanızın atm ağı oldukça geniş bu da işlem yapmamı kolaylaştırıyor,atm
ATM'lerinizdeki para çekme işlemleri oldukça hızlı ve pratik bir şekilde gerçekleşiyor,atm
ATM'lerinizdeki işlemlerde herhangi bir aksaklık yaşamadım ve memnun kaldım,atm
ATM'lerinizin temiz ve düzenli olması kullanıcı deneyimini olumlu yönde etkiliyor,atm
ATM'lerinizden para yatırma işlemleri kolayca yapılabiliyor ve anında hesaba geçiyor,atm
ATM'lerinizdeki menü seçenekleri oldukça anlaşılır ve kullanıcı dostu,atm
ATM'lerinizdeki para çekme limitleri ihtiyaçlarıma uygun ve yeterli,atm
ATM'lerinizin güvenliği konusunda rahatım ve herhangi bir sorun yaşamadım,atm
ATM'lerinizdeki işlem süreçleri oldukça hızlı ve bekleme sürem minimum,atm
ATM'lerinizdeki para yatırma işlemleri sıra beklemeden kolayca yapılabiliyor,atm
Bankanızın kredi kartı ekstresi oldukça detaylı ve anlaşılır bir şekilde sunuluyor,kredi kartı
Kredi kartımı kaybettiğimde bankanızın müşteri hizmetleri hemen yardımcı oldu ve kartımı bloke etti,kredi kartı
Kredi kartımın limitini yükseltmek için başvuruda bulundum ve hızlıca sonuçlandı,kredi kartı
Kredi kartı başvurumun onay sürecinde bankanızın sunduğu kolaylık ve hız memnuniyetimi sağladı,kredi kartı
Kredi kartımın internet bankacılığında görünen işlemleri anında takip edebiliyorum,kredi kartı
Kredi kartı ekstremdeki harcamalarımı analiz etmek için bankanızın sunduğu araçları kullanıyorum,kredi kartı
Kredi kartımın şifresini kolayca değiştirebiliyor ve güvenliğimi sağlıyorum,kredi kartı
Kredi kartıma yaptığım harcamaların nakit puanları diğer avantajlarla birleşince oldukça cazip,kredi kartı
Kredi kartımın online alışveriş güvenliği beni rahatlatıyor ve güvende hissettiriyor,kredi kartı
Kredi kartımın geri ödeme tarihini değiştirmek istedim ve bankanızın müşteri hizmetleri işlemi hızlıca tamamladı,kredi kartı
İnternet bankacılığınızın kullanıcı arayüzü oldukça pratik ve işlemleri hızlıca gerçekleştirmeme yardımcı oluyor,internet bankacılığı
İnternet bankacılığınızda yer alan hesap analiz araçları harcamalarımı anlamamı kolaylaştırıyor,internet bankacılığı
İnternet bankacılığınızı kullanarak hesap hareketlerimi kontrol etmek oldukça kolay ve zaman tasarrufu sağlıyor,internet bankacılığı
İnternet bankacılığınızdaki otomatik ödeme talimatları faturalarımın düzenli olarak ödenmesini sağlıyor,internet bankacılığı
İnternet bankacılığınızda işlem yapmak güvenli ve herhangi bir aksaklık yaşamadım,internet bankacılığı
İnternet bankacılığınızın şifre değiştirme ve güncelleme süreçleri oldukça basit ve hızlı,internet bankacılığı
İnternet bankacılığınızda kredi başvurusu yapmak oldukça kolay ve işlem süreci hızlı,internet bankacılığı
İnternet bankacılığınızdaki canlı destek hattı sorularımı hızlıca yanıtlıyor ve destek sağlıyor,internet bankacılığı
İnternet bankacılığınızdaki işlem onay süreçleri güvenlik önlemleri açısından tatmin edici,internet bankacılığı
İnternet bankacılığınızın mobil uygulama ile entegrasyonu işlem geçmişimi kolayca takip etmemi sağlıyor,internet bankacılığı
Faiz oranları hakkında bankanızın internet sitesinden güncel bilgi alabiliyorum,faiz işlem
Faiz işlemi yapmak için bankanızın mobil uygulamasını kullanıyorum ve işlem oldukça hızlı gerçekleşiyor,faiz işlem
Faiz işlemi sırasında bankanızın sunduğu faiz hesaplayıcı aracı tutarı önceden tahmin etmemi sağlıyor,faiz işlem
Faiz işlemi yapmadan önce bankanızın müşteri hizmetleri ile iletişime geçtim ve detaylı bilgi aldım,faiz işlem
Bankanızın mevduat faiz oranları diğer bankalara göre oldukça cazip,faiz işlem
Faiz işlemi yapmak için bankanızın şubesine gitmem gerekmedi internet bankacılığı ile hallettim,faiz işlem
Faiz işlemi sırasında bankanızın hesap analiz araçları kazancımı görsel olarak görmemi sağladı,faiz işlem
Faiz oranlarının yükseldiği dönemde bankanızın özel faiz fırsatlarından yararlandım,faiz işlem
Faiz işlemim sırasında bankanızın mobil uygulamasında işlem onayı süreci oldukça hızlıydı,faiz işlem
Faiz işlemi için bankanızın internet sitesindeki hesaplayıcı aracı oldukça kullanışlı ve işlevsel,faiz işlem
Bankanızın şubesi temiz ve düzenli bir şekilde hizmet veriyor ve beni memnun ediyor,şube hizmeti
Şubenizdeki müşteri temsilcileri işlem süreçlerini anlayışla ve hızlıca tamamlıyor,şube hizmeti
Bankanızın şubesi ihtiyacım olan tüm hizmetleri tek bir çatı altında sunuyor,şube hizmeti
Şubenizdeki atm'ler işlem yapmak için uzun sıra beklememe yardımcı oluyor,şube hizmeti
Şubenizdeki müşteri temsilcileri hesap işlemleri ve kredi başvurusu konusunda detaylı bilgi sağlıyor,şube hizmeti
Bankanızın şubesi ihtiyacım olan finansal ürünleri anlayışla ve detaylı bir şekilde açıklıyor,şube hizmeti
Şubenizdeki işlem süreçleri oldukça hızlı ve müşteri memnuniyetine yönelik,şube hizmeti
Şubenizdeki müşteri temsilcileri hesap analiz araçları konusunda bilgi sağlayarak karar vermemi kolaylaştırdı,şube hizmeti
Şubenizdeki güler yüzlü personel bankanıza olan güvenimi artırıyor ve kendimi önemli hissettiriyor,şube hizmeti
Bankanızın şubesi işlem süreçlerini basit ve anlaşılır bir şekilde sunarak beni rahatlatıyor,şube hizmeti
Bankanızın çağrı merkezi herhangi bir sorun yaşadığımda hızlıca destek sağlıyor,çağrı merkezi
Çağrı merkezi temsilcileri sorularıma sabırla ve anlayışla yanıt veriyor ve beni memnun ediyor,çağrı merkezi
Çağrı merkezinizi aradığımda kısa sürede bir müşteri temsilcisi ile görüşebiliyorum,çağrı merkezi
Bankanızın çağrı merkezine ulaşım oldukça kolay ve erişilebilir durumda,çağrı merkezi
Çağrı merkezinizdeki işlem süreçleri oldukça hızlı ve pratik bir şekilde tamamlanıyor,çağrı merkezi
Çağrı merkezi temsilcileriniz kredi başvurusu konusunda gereken belgeleri detaylıca anlatıyor,çağrı merkezi
Çağrı merkeziniz hesap işlemleri ve banka ürünleri hakkında detaylı bilgi sağlıyor,çağrı merkezi
Çağrı merkezinizdeki müşteri temsilcileri tatil günleri dahil sürekli erişilebilir durumda,çağrı merkezi
Çağrı merkeziniz işlem süreçlerini takip etmek ve geri bildirimde bulunmak için oldukça kullanışlı,çağrı merkezi
Çağrı merkezinizdeki müşteri temsilcileri güler yüzlü ve işini severek yapıyor,çağrı merkezi
Bankanızın para transferi hizmeti diğer bankalara göre oldukça hızlı ve güvenli,para transferi
Para transferi işlemi için bankanızın mobil uygulamasını tercih ettim ve işlemim sorunsuzca tamamlandı,para transferi
Bankanızın internet bankacılığı üzerinden yaptığım para transferi anında hesaba geçti ve memnun kaldım,para transferi
Para transferi sırasında bankanızın sunduğu ek güvenlik adımları hesabımın korunmasına yardımcı oldu,para transferi
Bankanızın para transferi hizmeti yurt içi ve yurt dışı işlemlerde oldukça kullanışlı,para transferi
Para transferi işlemi sırasında bankanızın mobil uygulamasındaki onay süreci oldukça hızlıydı,para transferi
Bankanızın para transferi ücretleri diğer bankalara göre oldukça avantajlı,para transferi
Para transferi sırasında bankanızın müşteri temsilcileri herhangi bir gecikme yaşamadan işlemimi tamamladı,para transferi
Para transferi işlemi için bankanızın internet sitesindeki menü seçenekleri oldukça anlaşılır,para transferi
Bankanızın para transferi hizmeti anlık olarak yapılan işlemlerde güven veriyor,para transferi
Bankanızın pos cihazları iş yerimde kullanımı kolay ve hızlı bir şekilde işlem yapmama olanak sağlıyor,pos
POS cihazınızın kullanım kılavuzu oldukça açıklayıcı ve işlem süreçlerini kolaylaştırıyor,pos
POS cihazlarınızın şarj süresi oldukça uzun bu da işlem yaparken kesinti yaşamamı engelliyor,pos
POS cihazınızın işlem süreci oldukça hızlı ve müşterilerim memnun kalıyor,pos
Bankanızın POS cihazları ödeme onay sürecini hızlandırıyor ve sıra bekleme süresini azaltıyor,pos
POS cihazınızın dokunmatik ekranı işlem yapmayı kolay ve kullanıcı dostu hale getiriyor,pos
Bankanızın POS cihazları çevrimdışı işlemlerde de oldukça güvenli ve sorunsuz çalışıyor,pos
POS cihazlarınızın tasarımı masamda az yer kaplaması açısından oldukça pratik,pos
POS cihazlarınızın kablosuz bağlantısı hareket özgürlüğümü artırıyor ve işlem yapmamı kolaylaştırıyor,pos
POS cihazınızın ödeme onay süreci oldukça hızlı bu da müşteri memnuniyetini artırıyor,pos
Müşteri hizmetleri ekibi şüpheli bir işlemi hızlıca inceleyerek sorunumu çözdü,müşteri hizmetleri
Müşteri hizmetleri temsilciniz hesap bilgilerimde güncelleme yapmam konusunda yardımcı oldu,müşteri hizmetleri
Müşteri hizmetleri ekibiniz kartımın çalınması durumunda hemen kartımı bloke etti,müşteri hizmetleri
Müşteri hizmetleri temsilciniz hesabımdaki bir ücretin yanlış olduğunu doğrulayarak düzeltti,müşteri hizmetleri
Müşteri hizmetleri ekibiniz banka ürünleri hakkında detaylı bilgi sağladı ve seçim yapmamda yardımcı oldu,müşteri hizmetleri
Müşteri hizmetleri temsilciniz internet bankacılığında yaşadığım bir sorunu hızlıca çözdü,müşteri hizmetleri
Müşteri hizmetleri ekibiniz hesabımdaki parayı yanlışlıkla başka bir hesaba gönderdiğimde hemen düzeltti,müşteri hizmetleri
Müşteri hizmetleri temsilciniz kaybolan kredi kartımın yerine yeni bir kart talebi işlemimi hızlıca gerçekleştirdi,müşteri hizmetleri
Müşteri hizmetleri ekibiniz mobil uygulamada yaşadığım bir güncelleme hatasını düzeltmemde yardımcı oldu,müşteri hizmetleri
Müşteri hizmetleri temsilciniz hesap kesim tarihini değiştirme talebimi hemen işleme aldı,müşteri hizmetleri
Kredi başvurumu bankanızın internet sitesinden online olarak kolayca tamamladım,kredi başvurusu
Kredi başvurum sırasında bankanızın müşteri temsilcisi talep ettiğim kredi miktarı hakkında detaylı bilgi verdi,kredi başvurusu
Kredi başvurumu mobil uygulamanız üzerinden hızlıca gerçekleştirdim ve sonuçlandırma süresi oldukça kısaydı,kredi başvurusu
Kredi başvurumda gereken belgeleri bankanızın çağrı merkezinden öğrenerek kolayca hazırladım,kredi başvurusu
Kredi başvurumu şubeye giderek yaptım ve müşteri temsilcisi işlem sürecimde yardımcı oldu,kredi başvurusu
Kredi başvurumun onaylanma süreci oldukça hızlıydı ve ihtiyacım olan parayı hemen kullanabildim,kredi başvurusu
Kredi başvurum sırasında bankanızın sunduğu faiz oranları oldukça uygun ve avantajlıydı,kredi başvurusu
Kredi başvurumun sonucunu öğrenmek için bankanızın çağrı merkezini aradım ve hızlıca bilgi aldım,kredi başvurusu
Kredi başvurumun onay sürecinde bankanızın sunduğu sigorta seçeneklerinden yararlandım,kredi başvurusu
Kredi başvurumu bankanızın internet bankacılığı aracılığıyla yaparak zamanımı tasarruf ettim,kredi başvurusu
Mobil uygulamanızın arayüzü oldukça kullanıcı dostu ve işlemleri hızlıca gerçekleştirmeme yardımcı oluyor,mobil uygulama
Mobil uygulamanızda yer alan hesap analiz araçları harcamalarımı takip etmeme büyük kolaylık sağlıyor,mobil uygulama
Mobil uygulamanız üzerinden para transferi yapmak güvenli ve hızlı bir şekilde gerçekleşiyor,mobil uygulama
Mobil uygulamanızdaki otomatik ödeme talimatları faturalarımın düzenli olarak ödenmesini sağlıyor,mobil uygulama
Mobil uygulamanızda yer alan kredi başvuru seçeneği ihtiyaç kredisi için kolayca başvurabilmemi sağladı,mobil uygulama
Mobil uygulamanızın güvenlik önlemleri hesabımın korunmasına yardımcı oluyor,mobil uygulama
Mobil uygulamanızı kullanarak hesap hareketlerimi anlık olarak takip edebiliyorum,mobil uygulama
Mobil uygulamanızdaki müşteri hizmetleri butonu herhangi bir soru sormak için hızlı erişim sağlıyor,mobil uygulama
Mobil uygulamanızda kredi kartı işlemlerimi kolayca kontrol edebiliyorum,mobil uygulama
Mobil uygulamanızın bildirimleri hesap hareketlerim hakkında bana anlık bilgi sağlıyor,mobil uygulama
Bankanızın ücretlendirme politikası oldukça şeffaf ve anlaşılır bir şekilde sunuluyor,ücretlendirme
Ücretlendirme konusunda bankanızın müşteri temsilcileri gereken bilgi ve açıklamaları sağlıyor,ücretlendirme
Hesap işletim ücretleriniz diğer bankalara göre oldukça uygun ve avantajlı,ücretlendirme
Bankanızın kredi kartı ücretleri sunduğu avantajlarla dengeli ve müşteri dostu,ücretlendirme
Ücretlendirme politikasındaki değişiklikler önceden bildirilerek müşteri memnuniyeti sağlanıyor,ücretlendirme
Ücretlendirme konusundaki bilgiler bankanızın internet sitesinde detaylıca yer alıyor,ücretlendirme
Bankanızın atm kullanım ücretleri geniş atm ağı ile müşteriye kolaylık sağlıyor,ücretlendirme
Ücretlendirme politikasındaki hesap kesim tarihi ve detayları düzenli olarak ekstrede yer alıyor,ücretlendirme
Bankanızın mobil uygulama ve internet bankacılığındaki işlem ücretleri diğer alternatiflere göre makul,ücretlendirme
Ücretlendirme konusundaki bilgiler bankanızın müşteri hizmetleri tarafından anında sağlanıyor,ücretlendirme
Bankanızın atm ağı oldukça geniş bu da işlem yapmamı kolaylaştırıyor,atm
ATM'lerinizdeki para çekme işlemleri oldukça hızlı ve pratik bir şekilde gerçekleşiyor,atm
ATM'lerinizdeki işlemlerde herhangi bir aksaklık yaşamadım ve memnun kaldım,atm
ATM'lerinizin temiz ve düzenli olması kullanıcı deneyimini olumlu yönde etkiliyor,atm
ATM'lerinizden para yatırma işlemleri kolayca yapılabiliyor ve anında hesaba geçiyor,atm
ATM'lerinizdeki menü seçenekleri oldukça anlaşılır ve kullanıcı dostu,atm
ATM'lerinizdeki para çekme limitleri ihtiyaçlarıma uygun ve yeterli,atm
ATM'lerinizin güvenliği konusunda rahatım ve herhangi bir sorun yaşamadım,atm
ATM'lerinizdeki işlem süreçleri oldukça hızlı ve bekleme sürem minimum,atm
ATM'lerinizdeki para yatırma işlemleri sıra beklemeden kolayca yapılabiliyor,atm
Bankanızın kredi kartı ekstresi oldukça detaylı ve anlaşılır bir şekilde sunuluyor,kredi kartı
Kredi kartımı kaybettiğimde bankanızın müşteri hizmetleri hemen yardımcı oldu ve kartımı bloke etti,kredi kartı
Kredi kartımın limitini yükseltmek için başvuruda bulundum ve hızlıca sonuçlandı,kredi kartı
Kredi kartı başvurumun onay sürecinde bankanızın sunduğu kolaylık ve hız memnuniyetimi sağladı,kredi kartı
Kredi kartımın internet bankacılığında görünen işlemleri anında takip edebiliyorum,kredi kartı
Kredi kartı ekstremdeki harcamalarımı analiz etmek için bankanızın sunduğu araçları kullanıyorum,kredi kartı
Kredi kartımın şifresini kolayca değiştirebiliyor ve güvenliğimi sağlıyorum,kredi kartı
Kredi kartıma yaptığım harcamaların nakit puanları diğer avantajlarla birleşince oldukça cazip,kredi kartı
Kredi kartımın online alışveriş güvenliği beni rahatlatıyor ve güvende hissettiriyor,kredi kartı
Kredi kartımın geri ödeme tarihini değiştirmek istedim ve bankanızın müşteri hizmetleri işlemi hızlıca tamamladı,kredi kartı
İnternet bankacılığınızın kullanıcı arayüzü oldukça pratik ve işlemleri hızlıca gerçekleştirmeme yardımcı oluyor,internet bankacılığı
İnternet bankacılığınızda yer alan hesap analiz araçları harcamalarımı anlamamı kolaylaştırıyor,internet bankacılığı
İnternet bankacılığınızı kullanarak hesap hareketlerimi kontrol etmek oldukça kolay ve zaman tasarrufu sağlıyor,internet bankacılığı
İnternet bankacılığınızdaki otomatik ödeme talimatları faturalarımın düzenli olarak ödenmesini sağlıyor,internet bankacılığı
İnternet bankacılığınızda işlem yapmak güvenli ve herhangi bir aksaklık yaşamadım,internet bankacılığı
İnternet bankacılığınızın şifre değiştirme ve güncelleme süreçleri oldukça basit ve hızlı,internet bankacılığı
İnternet bankacılığınızda kredi başvurusu yapmak oldukça kolay ve işlem süreci hızlı,internet bankacılığı
İnternet bankacılığınızdaki canlı destek hattı sorularımı anında yanıtlamada etkili,internet bankacılığı
İnternet bankacılığınızın mobil uygulaması ile hesaplarımı kolayca yönetebiliyorum,internet bankacılığı
İnternet bankacılığınızdaki hesap işlemlerimde herhangi bir güvenlik sorunu yaşamadım ve memnun kaldım,internet bankacılığı
Faiz işlemi yaparken bankanızın sunduğu hesap analiz araçları kazancımı görsel olarak görmemi sağladı,faiz işlem
Faiz işlemi sırasında bankanızın hesap faizi konusunda detaylı bilgi sağladı ve memnun kaldım,faiz işlem
Faiz işlemi sırasında bankanızın mobil uygulamasındaki onay süreci oldukça hızlıydı,faiz işlem
Faiz işlemi yapmadan önce bankanızın müşteri hizmetleri ile iletişime geçtim ve detaylı bilgi aldım,faiz işlem
Faiz oranlarının yükseldiği dönemde bankanızın özel faiz fırsatlarından yararlandım,faiz işlem
Faiz işlemi yapmak için bankanızın şubesine gitmem gerekmedi internet bankacılığı ile hallettim,faiz işlem
Faiz oranları hakkında bankanızın internet sitesinden güncel bilgi alabiliyorum,faiz işlem
